<?xml version="1.0" encoding="UTF-8"?>
<PmtRootElement xmlns:xsi="http://www.w3.org/2001/XMLSchema-instance" xsi:noNamespaceSchemaLocation="AttrFacet.xsd" xsi:SchemaLocation="AttrFacet.xsd">
	<ABC5 xsi:nil="true"/>
	<ABC1>21</ABC1>
	<ABC2 Timestamp="07/01/2002" Attr1="11" Attr3="1" FixedAtrribute="Green" Ref_Attr="Cyan" UseAttribute1="1" UseAttribute2="Red">
		<XYZ1>Blue</XYZ1>
		<XYZ2>11</XYZ2>
	</ABC2>
	<ABC3>2</ABC3>
	<Ref_Element attr9="99">
		<Ref_XYZ1>123</Ref_XYZ1>
		<Ref_XYZ2>test</Ref_XYZ2>
		<Ref_XYZ3 Attr6="2">
			<ABC attr7="333">1233</ABC>
			<DEF>32</DEF>
		</Ref_XYZ3>
	</Ref_Element>
	<ABC4>
		<XYZ3/>
		<XYZ4/>
	</ABC4>
	<ABCD Attr5="0" EffectiveDate="2000-01-10">
		<ABC/>
		<DEF/>
	</ABCD>
</PmtRootElement>
